{
  "schemaVersion": "1.0",
  "sourceRequirement": "SCRUM-6",
  "review": {
    "status": "needs-review",
    "notes": [
      "Generated by the offline Phase C generator; human review is required.",
      "Duplicate-title policy, list ordering, and security behavior are not specified by the requirement."
    ]
  },
  "scenarios": [
    {
      "scenarioId": "SCRUM-6-S01",
      "title": "Create a task with title and description",
      "requirementReference": "SCRUM-6",
      "preconditions": [
        "TaskFlow API is running",
        "The test database is reset for the scenario"
      ],
      "testData": {
        "title": "Prepare release notes",
        "description": "Summarize the release"
      },
      "steps": [
        "POST /tasks with a valid title and description"
      ],
      "expectedResult": [
        "Response status is 201",
        "Response contains a generated numeric id",
        "Location header identifies the new task",
        "Response preserves title and description"
      ],
      "priority": "high",
      "testType": "positive",
      "automationCandidate": true,
      "tags": [
        "smoke",
        "api",
        "regression"
      ]
    },
    {
      "scenarioId": "SCRUM-6-S02",
      "title": "Create a task with title only",
      "requirementReference": "SCRUM-6",
      "preconditions": [
        "TaskFlow API is running",
        "The test database is reset for the scenario"
      ],
      "testData": {
        "title": "Review test results"
      },
      "steps": [
        "POST /tasks with a valid title and no description"
      ],
      "expectedResult": [
        "Response status is 201",
        "Task is persisted with an optional description"
      ],
      "priority": "high",
      "testType": "positive",
      "automationCandidate": true,
      "tags": [
        "smoke",
        "api"
      ]
    },
    {
      "scenarioId": "SCRUM-6-S03",
      "title": "Reject a blank title",
      "requirementReference": "SCRUM-6",
      "preconditions": [
        "TaskFlow API is running",
        "The test database is reset for the scenario"
      ],
      "testData": {
        "title": "   ",
        "description": "Invalid task"
      },
      "steps": [
        "POST /tasks with whitespace-only title"
      ],
      "expectedResult": [
        "Response status is 400",
        "Response identifies the title validation error",
        "No task is created"
      ],
      "priority": "high",
      "testType": "validation",
      "automationCandidate": true,
      "tags": [
        "validation",
        "negative"
      ]
    },
    {
      "scenarioId": "SCRUM-6-S04",
      "title": "Reject a missing title",
      "requirementReference": "SCRUM-6",
      "preconditions": [
        "TaskFlow API is running",
        "The test database is reset for the scenario"
      ],
      "testData": {
        "description": "Missing title"
      },
      "steps": [
        "POST /tasks without a title field"
      ],
      "expectedResult": [
        "Response status is 400",
        "Response provides useful validation details",
        "No task is created"
      ],
      "priority": "high",
      "testType": "validation",
      "automationCandidate": true,
      "tags": [
        "validation",
        "negative"
      ]
    },
    {
      "scenarioId": "SCRUM-6-S05",
      "title": "Retrieve the created task",
      "requirementReference": "SCRUM-6",
      "preconditions": [
        "TaskFlow API is running",
        "The test database is reset for the scenario"
      ],
      "testData": {
        "title": "Retrieve me",
        "description": "Persistence check"
      },
      "steps": [
        "POST /tasks with valid data",
        "Read the returned task ID",
        "GET /tasks/{id}"
      ],
      "expectedResult": [
        "GET response status is 200",
        "Retrieved task matches the created title and description"
      ],
      "priority": "high",
      "testType": "persistence",
      "automationCandidate": true,
      "tags": [
        "smoke",
        "persistence",
        "regression"
      ]
    },
    {
      "scenarioId": "SCRUM-6-S06",
      "title": "Reject malformed JSON",
      "requirementReference": "SCRUM-6",
      "preconditions": [
        "TaskFlow API is running",
        "The test database is reset for the scenario"
      ],
      "testData": {
        "body": "{\"title\":",
        "contentType": "application/json"
      },
      "steps": [
        "POST /tasks with malformed JSON"
      ],
      "expectedResult": [
        "Request is rejected with a client-error response",
        "The server does not create a partial task"
      ],
      "priority": "medium",
      "testType": "error-handling",
      "automationCandidate": true,
      "tags": [
        "negative",
        "api"
      ]
    },
    {
      "scenarioId": "SCRUM-6-S07",
      "title": "Preserve unique generated IDs across creates",
      "requirementReference": "SCRUM-6",
      "preconditions": [
        "TaskFlow API is running",
        "The test database is reset for the scenario"
      ],
      "testData": {
        "firstTitle": "First task",
        "secondTitle": "Second task"
      },
      "steps": [
        "POST /tasks twice with different valid titles"
      ],
      "expectedResult": [
        "Both requests succeed",
        "Generated IDs are present and distinct"
      ],
      "priority": "medium",
      "testType": "boundary",
      "automationCandidate": true,
      "tags": [
        "api",
        "persistence"
      ]
    },
    {
      "scenarioId": "SCRUM-6-S08",
      "title": "Trace create behavior to the requirement",
      "requirementReference": "SCRUM-6",
      "preconditions": [
        "TaskFlow API is running",
        "The test database is reset for the scenario"
      ],
      "testData": {
        "requirementId": "SCRUM-6"
      },
      "steps": [
        "Run the approved create-task smoke scenarios"
      ],
      "expectedResult": [
        "Each automated result can be linked to the requirement and scenario ID"
      ],
      "priority": "medium",
      "testType": "regression",
      "automationCandidate": true,
      "tags": [
        "regression",
        "traceability"
      ]
    }
  ]
}
